{
  "$schema": "https://json-schema.org/draft/2020-12/schema",
  "title": "B2 semantic judge response",
  "type": "object",
  "required": ["run_id", "configuration_id", "material_results", "event_results", "limitations"],
  "properties": {
    "run_id": {"type": "string"},
    "configuration_id": {"type": "string"},
    "material_results": {
      "type": "array",
      "items": {
        "type": "object",
        "required": ["id", "must_fact_coverage", "unsupported_claims", "summary_faithfulness", "impact_justification"],
        "properties": {
          "id": {"type": "string"},
          "must_fact_coverage": {"type": "number", "minimum": 0, "maximum": 1},
          "unsupported_claims": {"type": "array", "items": {"type": "string"}},
          "summary_faithfulness": {"enum": ["pass", "fail"]},
          "impact_justification": {"enum": ["pass", "fail", "not_applicable"]}
        }
      }
    },
    "event_results": {
      "type": "array",
      "items": {
        "type": "object",
        "required": ["case_id", "preserved_unique_facts", "preserved_independent_positions"],
        "properties": {
          "case_id": {"type": "string"},
          "preserved_unique_facts": {"enum": ["pass", "fail"]},
          "preserved_independent_positions": {"enum": ["pass", "fail", "not_applicable"]}
        }
      }
    },
    "limitations": {"type": "array", "items": {"type": "string"}, "minItems": 1}
  }
}
